{
  "feature": "<feature-slug>",
  "prd": "prd/prd-spec.md",
  "design": "design/tech-design.md",
  "created": "YYYY-MM-DD",
  "status": "planning",
  "statusEnum": ["pending", "in_progress", "completed", "blocked", "skipped", "rejected"],
  "priorityEnum": ["P0", "P1", "P2"],
  "e2eRound": 0,
  "tasks": {
    "1.1-interfaces": {
      "id": "1.1",
      "title": "Define Interfaces",
      "priority": "P0",
      "estimatedTime": "2h",
      "status": "pending",
      "scope": "all",
      "breaking": true,
      "file": "1.1-interfaces.md",
      "record": "records/1.1-interfaces.md"
    },
    "1.2-models": {
      "id": "1.2",
      "title": "Define Data Models",
      "priority": "P0",
      "estimatedTime": "3h",
      "dependencies": ["1.1"],
      "status": "pending",
      "scope": "backend",
      "file": "1.2-models.md",
      "record": "records/1.2-models.md"
    },
    "1-summary": {
      "id": "1.summary",
      "title": "Phase 1 Summary",
      "priority": "P0",
      "estimatedTime": "15min",
      "dependencies": ["1.x"],
      "status": "pending",
      "scope": "all",
      "noTest": true,
      "file": "1-summary.md",
      "record": "records/1-summary.md"
    },
    "1-gate": {
      "id": "1.gate",
      "title": "Phase 1 Exit Gate",
      "priority": "P0",
      "estimatedTime": "1h",
      "dependencies": ["1.summary"],
      "status": "pending",
      "scope": "all",
      "breaking": true,
      "file": "1-gate.md",
      "record": "records/1-gate.md"
    },
    "2.1-implementation": {
      "id": "2.1",
      "title": "Core Implementation",
      "priority": "P0",
      "estimatedTime": "4h",
      "dependencies": ["1.gate"],
      "status": "pending",
      "scope": "frontend",
      "file": "2.1-implementation.md",
      "record": "records/2.1-implementation.md"
    },
    "2-summary": {
      "id": "2.summary",
      "title": "Phase 2 Summary",
      "priority": "P0",
      "estimatedTime": "15min",
      "dependencies": ["2.x"],
      "status": "pending",
      "scope": "all",
      "noTest": true,
      "file": "2-summary.md",
      "record": "records/2-summary.md"
    },
    "2-gate": {
      "id": "2.gate",
      "title": "Phase 2 Exit Gate",
      "priority": "P0",
      "estimatedTime": "1h",
      "dependencies": ["2.summary"],
      "status": "pending",
      "scope": "all",
      "breaking": true,
      "file": "2-gate.md",
      "record": "records/2-gate.md"
    },
    "gen-test-cases": {
      "id": "T-test-1",
      "title": "Generate e2e Test Cases",
      "priority": "P1",
      "estimatedTime": "1-2h",
      "dependencies": ["2.gate"],
      "status": "pending",
      "scope": "all",
      "noTest": true,
      "file": "gen-test-cases.md",
      "record": "records/gen-test-cases.md"
    },
    "eval-test-cases": {
      "id": "T-test-1b",
      "title": "Evaluate e2e Test Cases",
      "priority": "P1",
      "estimatedTime": "30min",
      "dependencies": ["T-test-1"],
      "status": "pending",
      "scope": "all",
      "noTest": true,
      "mainSession": true,
      "file": "eval-test-cases.md",
      "record": "records/eval-test-cases.md"
    },
    "gen-test-scripts": {
      "id": "T-test-2",
      "title": "Generate e2e Test Scripts",
      "priority": "P1",
      "estimatedTime": "1-2h",
      "dependencies": ["T-test-1b"],
      "status": "pending",
      "scope": "all",
      "file": "gen-test-scripts.md",
      "record": "records/gen-test-scripts.md"
    },
    "run-e2e-tests": {
      "id": "T-test-3",
      "title": "Run e2e Tests",
      "priority": "P1",
      "estimatedTime": "30min-1h",
      "dependencies": ["T-test-2"],
      "status": "pending",
      "scope": "all",
      "file": "run-e2e-tests.md",
      "record": "records/run-e2e-tests.md"
    },
    "graduate-tests": {
      "id": "T-test-4",
      "title": "Graduate Test Scripts",
      "priority": "P1",
      "estimatedTime": "30min",
      "dependencies": ["T-test-3"],
      "status": "pending",
      "scope": "all",
      "file": "graduate-tests.md",
      "record": "records/graduate-tests.md"
    },
    "verify-regression": {
      "id": "T-test-4.5",
      "title": "Verify Full E2E Regression",
      "priority": "P1",
      "estimatedTime": "15-30min",
      "dependencies": ["T-test-4"],
      "status": "pending",
      "scope": "all",
      "file": "verify-regression.md",
      "record": "records/verify-regression.md"
    },
    "consolidate-specs": {
      "id": "T-test-5",
      "title": "Consolidate Specs",
      "priority": "P2",
      "estimatedTime": "20min",
      "dependencies": ["T-test-4.5"],
      "status": "pending",
      "scope": "all",
      "noTest": true,
      "file": "consolidate-specs.md",
      "record": "records/consolidate-specs.md"
    }
  }
}
