{
  "feature": "feat-log-decisions",
  "prd": "prd/prd-spec.md",
  "design": "design/tech-design.md",
  "created": "2026-04-23",
  "status": "planning",
  "tasks": {
    "1.1-rename-design-tech-skill": {
      "id": "1.1",
      "title": "Rename design-tech skill directory to tech-design",
      "priority": "P0",
      "estimatedTime": "1-2h",
      "status": "completed",
      "file": "1.1-rename-design-tech-skill.md",
      "record": "records/1.1-rename-design-tech-skill.md"
    },
    "2.1-create-decisions-directory": {
      "id": "2.1",
      "title": "Create docs/decisions/ directory structure",
      "priority": "P0",
      "estimatedTime": "1h",
      "status": "completed",
      "file": "2.1-create-decisions-directory.md",
      "record": "records/2.1-create-decisions-directory.md"
    },
    "2.2-create-decision-entry-template": {
      "id": "2.2",
      "title": "Create decision-entry.md template",
      "priority": "P1",
      "estimatedTime": "0.5h",
      "status": "pending",
      "file": "2.2-create-decision-entry-template.md",
      "record": "records/2.2-create-decision-entry-template.md"
    },
    "3.1-create-decision-logging-shared": {
      "id": "3.1",
      "title": "Create plugins/zcode/references/shared/decision-logging.md",
      "priority": "P0",
      "estimatedTime": "2-3h",
      "dependencies": [
        "2.1",
        "2.2"
      ],
      "status": "pending",
      "file": "3.1-create-decision-logging-shared.md",
      "record": "records/3.1-create-decision-logging-shared.md"
    },
    "3.2-update-tech-design-skill": {
      "id": "3.2",
      "title": "Update tech-design SKILL.md with decision archiving step",
      "priority": "P0",
      "estimatedTime": "1-2h",
      "dependencies": [
        "1.1",
        "3.1"
      ],
      "status": "pending",
      "file": "3.2-update-tech-design-skill.md",
      "record": "records/3.2-update-tech-design-skill.md"
    },
    "4.1-create-record-decision-skill": {
      "id": "4.1",
      "title": "Create record-decision skill",
      "priority": "P0",
      "estimatedTime": "1-2h",
      "dependencies": [
        "3.1"
      ],
      "status": "pending",
      "file": "4.1-create-record-decision-skill.md",
      "record": "records/4.1-create-record-decision-skill.md"
    },
    "4.2-register-record-decision-skill": {
      "id": "4.2",
      "title": "Register record-decision in SKILLS.md and CLAUDE.md",
      "priority": "P1",
      "estimatedTime": "0.5h",
      "dependencies": [
        "1.1",
        "4.1"
      ],
      "status": "pending",
      "file": "4.2-register-record-decision-skill.md",
      "record": "records/4.2-register-record-decision-skill.md"
    },
    "4.3-update-reference-links": {
      "id": "4.3",
      "title": "Update reference links in hooks guide and exploration example",
      "priority": "P1",
      "estimatedTime": "0.5h",
      "dependencies": [
        "1.1",
        "2.1"
      ],
      "status": "pending",
      "file": "4.3-update-reference-links.md",
      "record": "records/4.3-update-reference-links.md"
    },
    "5.1-create-validate-manifest-script": {
      "id": "5.1",
      "title": "Create validate-manifest CI script",
      "priority": "P1",
      "estimatedTime": "1-2h",
      "dependencies": [
        "2.1"
      ],
      "status": "pending",
      "file": "5.1-create-validate-manifest-script.md",
      "record": "records/5.1-create-validate-manifest-script.md"
    }
  },
  "statusEnum": [
    "pending",
    "in_progress",
    "completed",
    "blocked",
    "skipped"
  ],
  "priorityEnum": [
    "P0",
    "P1",
    "P2"
  ]
}
